[
  {
    "id": "creation",
    "type": "event",
    "name": "Creation",
    "startYear": 4004,
    "endYear": 4004,
    "certainty": "estimated",
    "categories": [
      "creation"
    ],
    "themes": [
      "Origins"
    ],
    "priority": 2,
    "description": "God created the heavens, earth, and all living things in six days, resting on the seventh. He made humanity (Adam and Eve) in His own image to rule over creation.",
    "scriptureRefs": [
      "Genesis 1-2"
    ],
    "source": "Hindson, Ed, and Gary Yates, editors. The Essence of the Old Testament: A Survey. B&H Academic, 2012. Walton, John H. Chronological and Background Charts of the Old Testament. Revised and Expanded ed., Zondervan Academic, 1994. The Holy Bible, New International Version. Zondervan, 2011.",
    "swimlane": 0
  },
  {
    "id": "adam-eve",
    "type": "event",
    "name": "Adam & Eve",
    "startYear": 4004,
    "endYear": 4004,
    "certainty": "estimated",
    "categories": [
      "creation"
    ],
    "themes": [],
    "priority": 2,
    "description": "God formed Adam from the dust and created Eve from his rib. They lived in perfect fellowship with God in the Garden of Eden.",
    "scriptureRefs": [
      "Genesis 1-2"
    ],
    "source": "Hindson, Ed, and Gary Yates, editors. The Essence of the Old Testament: A Survey. B&H Academic, 2012. Walton, John H. Chronological and Background Charts of the Old Testament. Revised and Expanded ed., Zondervan Academic, 1994. The Holy Bible, New International Version. Zondervan, 2011.",
    "swimlane": 1
  },
  {
    "id": "the-fall",
    "type": "event",
    "name": "The Fall",
    "startYear": 4000,
    "endYear": 4000,
    "certainty": "estimated",
    "categories": [
      "creation"
    ],
    "themes": [
      "Origins"
    ],
    "priority": 2,
    "description": "Tempted by the serpent, Adam and Eve disobeyed God by eating the forbidden fruit. This introduced sin, shame, death, and separation from God into the human race.",
    "scriptureRefs": [
      "Genesis 3-5"
    ],
    "source": "Hindson, Ed, and Gary Yates, editors. The Essence of the Old Testament: A Survey. B&H Academic, 2012. Walton, John H. Chronological and Background Charts of the Old Testament. Revised and Expanded ed., Zondervan Academic, 1994. The Holy Bible, New International Version. Zondervan, 2011.",
    "swimlane": 0
  },
  {
    "id": "flood",
    "type": "event",
    "name": "The Great Flood",
    "startYear": 2500,
    "endYear": 2500,
    "certainty": "estimated",
    "categories": [
      "judgment"
    ],
    "themes": [
      "Judgment"
    ],
    "priority": 2,
    "description": "Because of widespread wickedness, God sent a global flood that destroyed all life except Noah’s family and the animals on the ark. The flood lasted about one year.",
    "scriptureRefs": [
      "Genesis 6-9"
    ],
    "source": "Hindson, Ed, and Gary Yates, editors. The Essence of the Old Testament: A Survey. B&H Academic, 2012. Walton, John H. Chronological and Background Charts of the Old Testament. Revised and Expanded ed., Zondervan Academic, 1994. The Holy Bible, New International Version. Zondervan, 2011.",
    "swimlane": 0
  },
  {
    "id": "tower-of-babel",
    "type": "event",
    "name": "The Dispersion of Nations (Tower of Babel)",
    "startYear": 2280,
    "endYear": 2280,
    "certainty": "approximate",
    "categories": [
      "judgment"
    ],
    "themes": [
      "Judgment"
    ],
    "priority": 2,
    "description": "Humanity built a tower to make a name for themselves and defy God. God confused their languages, causing them to scatter across the earth.",
    "scriptureRefs": [
      "Genesis 10"
    ],
    "source": "Hindson, Ed, and Gary Yates, editors. The Essence of the Old Testament: A Survey. B&H Academic, 2012. Walton, John H. Chronological and Background Charts of the Old Testament. Revised and Expanded ed., Zondervan Academic, 1994. The Holy Bible, New International Version. Zondervan, 2011.",
    "swimlane": 0
  },
  {
    "id": "call-of-abraham",
    "type": "event",
    "name": "The Call of Abraham",
    "startYear": 2091,
    "endYear": 2091,
    "certainty": "approximate",
    "categories": [
      "covenant"
    ],
    "themes": [
      "Covenant"
    ],
    "priority": 2,
    "description": "God called Abram to leave his homeland and go to a land He would show him. God promised to make Abram a great nation, bless him, and bless all nations through his offspring.",
    "scriptureRefs": [
      "Genesis 15"
    ],
    "source": "Hindson, Ed, and Gary Yates, editors. The Essence of the Old Testament: A Survey. B&H Academic, 2012. Walton, John H. Chronological and Background Charts of the Old Testament. Revised and Expanded ed., Zondervan Academic, 1994. The Holy Bible, New International Version. Zondervan, 2011.",
    "swimlane": 0
  },
  {
    "id": "ishmael-born",
    "type": "event",
    "name": "Ishmael born",
    "startYear": 2080,
    "endYear": 2080,
    "certainty": "approximate",
    "categories": [
      "patriarchal"
    ],
    "themes": [
      "Patriarchs"
    ],
    "priority": 2,
    "description": "Abraham and Sarah, impatient for God’s promise, had Abraham father a son through Hagar. Ishmael became the ancestor of many Arab peoples.",
    "scriptureRefs": [
      "Genesis 16"
    ],
    "source": "Hindson, Ed, and Gary Yates, editors. The Essence of the Old Testament: A Survey. B&H Academic, 2012. Walton, John H. Chronological and Background Charts of the Old Testament. Revised and Expanded ed., Zondervan Academic, 1994. The Holy Bible, New International Version. Zondervan, 2011.",
    "swimlane": 0
  },
  {
    "id": "birth-of-isaac",
    "type": "event",
    "name": "The Birth of Issac",
    "startYear": 2066,
    "endYear": 2066,
    "certainty": "approximate",
    "categories": [
      "covenant"
    ],
    "themes": [
      "Covenant"
    ],
    "priority": 2,
    "description": "Sarah miraculously gave birth to Isaac when Abraham was 100 and she was 90. Isaac was the child of promise through whom God’s covenant would continue.",
    "scriptureRefs": [
      "Genesis 21"
    ],
    "source": "Hindson, Ed, and Gary Yates, editors. The Essence of the Old Testament: A Survey. B&H Academic, 2012. Walton, John H. Chronological and Background Charts of the Old Testament. Revised and Expanded ed., Zondervan Academic, 1994. The Holy Bible, New International Version. Zondervan, 2011.",
    "swimlane": 0
  },
  {
    "id": "twelve-tribes-of-israel",
    "type": "event",
    "name": "The Twelve Tribes of Israel",
    "startYear": 1915,
    "endYear": 1915,
    "certainty": "approximate",
    "categories": [
      "patriarchal"
    ],
    "themes": [
      "Patriarchs"
    ],
    "priority": 2,
    "description": "The twelve sons of Jacob (Israel) by Leah, Rachel, Bilhah, and Zilpah became the ancestors of the twelve tribes of Israel.",
    "scriptureRefs": [
      "Genesis 29–30",
      "35:23-26"
    ],
    "source": "Hindson, Ed, and Gary Yates, editors. The Essence of the Old Testament: A Survey. B&H Academic, 2012. Walton, John H. Chronological and Background Charts of the Old Testament. Revised and Expanded ed., Zondervan Academic, 1994. The Holy Bible, New International Version. Zondervan, 2011.",
    "swimlane": 0
  },
  {
    "id": "josephs-exaltation-in-egypt",
    "type": "event",
    "name": "Josephs Exaltation in Egypt",
    "startYear": 1899,
    "endYear": 1805,
    "certainty": "approximate",
    "categories": [
      "patriarchal"
    ],
    "themes": [
      "Patriarchs"
    ],
    "priority": 2,
    "description": "Sold into slavery by his brothers, Joseph rose to become second-in-command in Egypt. He saved Egypt and his family from famine through God-given wisdom.",
    "scriptureRefs": [
      "Gen 37; 39-47"
    ],
    "source": "Hindson, Ed, and Gary Yates, editors. The Essence of the Old Testament: A Survey. B&H Academic, 2012. Walton, John H. Chronological and Background Charts of the Old Testament. Revised and Expanded ed., Zondervan Academic, 1994. The Holy Bible, New International Version. Zondervan, 2011.",
    "swimlane": 0
  },
  {
    "id": "code-of-hammurabi",
    "type": "event",
    "name": "Code of Hammurabi",
    "startYear": 1754,
    "endYear": 1754,
    "certainty": "approximate",
    "categories": [
      "secular-context"
    ],
    "themes": [],
    "priority": 2,
    "description": "King Hammurabi of Babylon established one of the earliest and most complete written legal codes in human history. The 282 laws, carved on a stone stele, governed commerce, property, family, and criminal justice across the Babylonian Empire.",
    "source": "Pritchard, James B., editor. Ancient Near Eastern Texts Relating to the Old Testament. 3rd ed., Princeton UP, 1969. Walton, John H. Chronological and Background Charts of the Old Testament. Revised and Expanded ed., Zondervan Academic, 1994.",
    "swimlane": 0
  },
  {
    "id": "rise-of-the-egyptian-new-kingdom",
    "type": "event",
    "name": "Rise of the Egyptian New Kingdom",
    "startYear": 1550,
    "endYear": 1070,
    "certainty": "approximate",
    "categories": [
      "secular-context"
    ],
    "themes": [],
    "priority": 2,
    "description": "Egypt entered its most powerful and prosperous era under dynasties XVIII–XX, expanding its empire from Nubia to the Euphrates. This period produced famous pharaohs such as Hatshepsut, Thutmose III, Akhenaten, and Ramesses II.",
    "source": "Shaw, Ian, editor. The Oxford History of Ancient Egypt. Oxford UP, 2000. Walton, John H. Chronological and Background Charts of the Old Testament. Revised and Expanded ed., Zondervan Academic, 1994.",
    "swimlane": 0
  },
  {
    "id": "exodus",
    "type": "event",
    "name": "The Exodus",
    "startYear": 1446,
    "endYear": 1446,
    "certainty": "approximate",
    "categories": [
      "deliverance"
    ],
    "themes": [
      "Deliverance"
    ],
    "priority": 2,